{
  "id": "00000001-0000-4000-8000-000000000001",
  "short_code": "K7M2Q9XR4T",
  "patient": {
    "id": "00000002-0000-4000-8000-000000000002",
    "display_name": "Paciente Simulado"
  },
  "sigtap_code": "0202020380",
  "sigtap_competence": "202610",
  "label": "HEMOGRAMA COMPLETO",
  "priority": "routine",
  "cid10_justification": null,
  "origin": "consultation",
  "consultation_id": "00000003-0000-4000-8000-000000000003",
  "consultation_exam_request_id": "00000004-0000-4000-8000-000000000004",
  "result_fields": [
    {
      "key": "hb",
      "label": "Hemoglobina",
      "unit": "g/dL",
      "loinc": "718-7"
    },
    {
      "key": "plt",
      "label": "Plaquetas",
      "unit": "10*3/uL",
      "loinc": "777-3"
    }
  ],
  "requester": {
    "user_id": "00000004-0000-4000-8000-000000000004",
    "name": "Profissional Simulado",
    "cns": null
  },
  "unit": {
    "id": "00000005-0000-4000-8000-000000000005",
    "name": "UBS Simulada"
  },
  "provider": {
    "id": "00000006-0000-4000-8000-000000000006",
    "name": "Laboratório Simulado"
  },
  "scheduled_at": "2026-10-10T08:00:00-03:00",
  "scheduled_place": "Posto de coleta central",
  "external_reference": null,
  "gal_requisition": null,
  "status": "resulted",
  "status_changed_at": "2026-10-13T14:05:00-03:00",
  "overdue": null,
  "escalated": true,
  "guide_url": null,
  "result": {
    "id": "00000007-0000-4000-8000-000000000007",
    "origin": "order",
    "source": "fhir",
    "released_on": "2026-10-13",
    "laboratory_name": "Laboratório Simulado"
  }
}
